{
  "schemaVersion": 1,
  "channel": "beta",
  "enabled": false,
  "testFixture": false,
  "version": "",
  "publishedAtUtc": "",
  "minimumUpdaterVersion": "1.1.0",
  "mandatory": false,
  "artifact": {
    "fileName": "ArenaBridge.exe",
    "url": "",
    "sha256": "",
    "sizeBytes": 0
  },
  "notes": [
    "Fixture"
  ]
}
